{
  "page_id": "fb3c59894bd2:page_031",
  "page_number": 31,
  "doc_id": "fb3c59894bd2",
  "layout_version_id": "c84625f1-3db9-43c5-a4da-12ffc5948c74",
  "geometry": {
    "pdf_page_width_pt": 595.276,
    "pdf_page_height_pt": 841.89,
    "rotation_deg": 0,
    "media_box_pt": [
      0.0,
      0.0,
      595.276,
      841.89
    ],
    "crop_box_pt": [
      0.0,
      0.0,
      595.276,
      841.89
    ],
    "render_dpi": 200,
    "render_scale": 2.7777777777777777,
    "rendered_width_px": 1654,
    "rendered_height_px": 2339
  },
  "layers": {
    "pdf_text": {
      "layer_id": "pdf_text",
      "source_engine": "pdfplumber/0.11.9",
      "coverage": 0.07333925090198118,
      "word_count": 170,
      "tokens": [
        {
          "token_id": "tok_000000",
          "text": "The",
          "bbox": {
            "x": 194,
            "y": 134,
            "width": 60,
            "height": 36
          },
          "font_name": "WBLURF+AvenirLTStd-Heavy",
          "font_size": 13.0,
          "is_bold": false,
          "is_italic": false
        },
        {
          "token_id": "tok_000001",
          "text": "July",
          "bbox": {
            "x": 264,
            "y": 134,
            "width": 64,
            "height": 36
          },
          "font_name": "WBLURF+AvenirLTStd-Heavy",
          "font_size": 13.0,
          "is_bold": false,
          "is_italic": false
        },
        {
          "token_id": "tok_000002",
          "text": "2024",
          "bbox": {
            "x": 337,
            "y": 134,
            "width": 83,
            "height": 36
          },
          "font_name": "WBLURF+AvenirLTStd-Heavy",
          "font_size": 13.0,
          "is_bold": false,
          "is_italic": false
        },
        {
          "token_id": "tok_000003",
          "text": "Issuances",
          "bbox": {
            "x": 428,
            "y": 134,
            "width": 150,
            "height": 36
          },
          "font_name": "WBLURF+AvenirLTStd-Heavy",
          "font_size": 13.0,
          "is_bold": false,
          "is_italic": false
        },
        {
          "token_id": "tok_000004",
          "text": "Allocation",
          "bbox": {
            "x": 194,
            "y": 239,
            "width": 131,
            "height": 29
          },
          "font_name": "WBLURF+AvenirLTStd-Heavy",
          "font_size": 10.5,
          "is_bold": false,
          "is_italic": false
        },
        {
          "token_id": "tok_000005",
          "text": "by",
          "bbox": {
            "x": 332,
            "y": 239,
            "width": 33,
            "height": 29
          },
          "font_name": "WBLURF+AvenirLTStd-Heavy",
          "font_size": 10.5,
          "is_bold": false,
          "is_italic": false
        },
        {
          "token_id": "tok_000006",
          "text": "Financial",
          "bbox": {
            "x": 372,
            "y": 239,
            "width": 113,
            "height": 29
          },
          "font_name": "WBLURF+AvenirLTStd-Heavy",
          "font_size": 10.5,
          "is_bold": false,
          "is_italic": false
        },
        {
          "token_id": "tok_000007",
          "text": "Year",
          "bbox": {
            "x": 492,
            "y": 239,
            "width": 57,
            "height": 29
          },
          "font_name": "WBLURF+AvenirLTStd-Heavy",
          "font_size": 10.5,
          "is_bold": false,
          "is_italic": false
        },
        {
          "token_id": "tok_000008",
          "text": "The",
          "bbox": {
            "x": 194,
            "y": 306,
            "width": 42,
            "height": 25
          },
          "font_name": "WBLURF+HelveticaNeue",
          "font_size": 9.0,
          "is_bold": false,
          "is_italic": false
        },
        {
          "token_id": "tok_000009",
          "text": "total",
          "bbox": {
            "x": 244,
            "y": 306,
            "width": 50,
            "height": 25
          },
          "font_name": "WBLURF+HelveticaNeue",
          "font_size": 9.0,
          "is_bold": false,
          "is_italic": false
        },
        {
          "token_id": "tok_000010",
          "text": "proceeds",
          "bbox": {
            "x": 300,
            "y": 306,
            "width": 108,
            "height": 25
          },
          "font_name": "WBLURF+HelveticaNeue",
          "font_size": 9.0,
          "is_bold": false,
          "is_italic": false
        },
        {
          "token_id": "tok_000011",
          "text": "of",
          "bbox": {
            "x": 415,
            "y": 306,
            "width": 22,
            "height": 25
          },
          "font_name": "WBLURF+HelveticaNeue",
          "font_size": 9.0,
          "is_bold": false,
          "is_italic": false
        },
        {
          "token_id": "tok_000012",
          "text": "the",
          "bbox": {
            "x": 444,
            "y": 306,
            "width": 36,
            "height": 25
          },
          "font_name": "WBLURF+HelveticaNeue",
          "font_size": 9.0,
          "is_bold": false,
          "is_italic": false
        },
        {
          "token_id": "tok_000013",
          "text": "July",
          "bbox": {
            "x": 486,
            "y": 306,
            "width": 46,
            "height": 25
          },
          "font_name": "WBLURF+HelveticaNeue",
          "font_size": 9.0,
          "is_bold": false,
          "is_italic": false
        },
        {
          "token_id": "tok_000014",
          "text": "2024",
          "bbox": {
            "x": 539,
            "y": 306,
            "width": 55,
            "height": 25
          },
          "font_name": "WBLURF+HelveticaNeue",
          "font_size": 9.0,
          "is_bold": false,
          "is_italic": false
        },
        {
          "token_id": "tok_000015",
          "text": "issuances",
          "bbox": {
            "x": 601,
            "y": 306,
            "width": 114,
            "height": 25
          },
          "font_name": "WBLURF+HelveticaNeue",
          "font_size": 9.0,
          "is_bold": false,
          "is_italic": false
        },
        {
          "token_id": "tok_000016",
          "text": "amounting",
          "bbox": {
            "x": 721,
            "y": 306,
            "width": 121,
            "height": 25
          },
          "font_name": "WBLURF+HelveticaNeue",
          "font_size": 9.0,
          "is_bold": false,
          "is_italic": false
        },
        {
          "token_id": "tok_000017",
          "text": "to",
          "bbox": {
            "x": 849,
            "y": 306,
            "width": 22,
            "height": 25
          },
          "font_name": "WBLURF+HelveticaNeue",
          "font_size": 9.0,
          "is_bold": false,
          "is_italic": false
        },
        {
          "token_id": "tok_000018",
          "text": "HK$24,880",
          "bbox": {
            "x": 878,
            "y": 306,
            "width": 126,
            "height": 25
          },
          "font_name": "WBLURF+HelveticaNeue",
          "font_size": 9.0,
          "is_bold": false,
          "is_italic": false
        },
        {
          "token_id": "tok_000019",
          "text": "million",
          "bbox": {
            "x": 1010,
            "y": 306,
            "width": 73,
            "height": 25
          },
          "font_name": "WBLURF+HelveticaNeue",
          "font_size": 9.0,
          "is_bold": false,
          "is_italic": false
        },
        {
          "token_id": "tok_000020",
          "text": "were",
          "bbox": {
            "x": 1090,
            "y": 306,
            "width": 55,
            "height": 25
          },
          "font_name": "WBLURF+HelveticaNeue",
          "font_size": 9.0,
          "is_bold": false,
          "is_italic": false
        },
        {
          "token_id": "tok_000021",
          "text": "fully",
          "bbox": {
            "x": 1152,
            "y": 306,
            "width": 46,
            "height": 25
          },
          "font_name": "WBLURF+HelveticaNeue",
          "font_size": 9.0,
          "is_bold": false,
          "is_italic": false
        },
        {
          "token_id": "tok_000022",
          "text": "allocated",
          "bbox": {
            "x": 1205,
            "y": 306,
            "width": 104,
            "height": 25
          },
          "font_name": "WBLURF+HelveticaNeue",
          "font_size": 9.0,
          "is_bold": false,
          "is_italic": false
        },
        {
          "token_id": "tok_000023",
          "text": "or",
          "bbox": {
            "x": 1316,
            "y": 306,
            "width": 23,
            "height": 25
          },
          "font_name": "WBLURF+HelveticaNeue",
          "font_size": 9.0,
          "is_bold": false,
          "is_italic": false
        },
        {
          "token_id": "tok_000024",
          "text": "earmarked",
          "bbox": {
            "x": 194,
            "y": 342,
            "width": 122,
            "height": 25
          },
          "font_name": "WBLURF+HelveticaNeue",
          "font_size": 9.0,
          "is_bold": false,
          "is_italic": false
        },
        {
          "token_id": "tok_000025",
          "text": "to",
          "bbox": {
            "x": 323,
            "y": 342,
            "width": 22,
            "height": 25
          },
          "font_name": "WBLURF+HelveticaNeue",
          "font_size": 9.0,
          "is_bold": false,
          "is_italic": false
        },
        {
          "token_id": "tok_000026",
          "text": "80",
          "bbox": {
            "x": 352,
            "y": 342,
            "width": 28,
            "height": 25
          },
          "font_name": "WBLURF+HelveticaNeue",
          "font_size": 9.0,